<!DOCTYPE beanTask SYSTEM "../dtds/beanTask.dtd">
<beanTask class="com.microstrategy.web.app.tasks.GetServerJSONResultsTask">
	<!-- 
		This information is used to provide "metadata" about this task. In
		general, it includes names, descriptions and whether the parameters
		are required or not.
	-->
	<basicInfo
		desc="This Task provides the ability to transform a report with the style specified on the request keys as 'styleName'.">
		<parameter name="styleName" desc="The style to use to transform the RWBean. If omitted, a simple MessageResult is generated." required="false" type="simplestring"/>
		<parameter name="rwb" desc="The state of the RWBean" required="false" type="simplestring"/>
		<parameter name="messageID" desc="The Message ID of a previously executed Document." required="false" />
		<parameter name="availableWidth" desc="The width of the available screen area. Used in the MicroStrategy Mobile app when document layout zoom type is fit to width or fit to page." required="false" defvalue="0" type="int"/>
        <parameter name="availableHeight" desc="The height of the available screen area. Used in the MicroStrategy Mobile app when document layout is optimized for micro-app and zoom type is fit to page." required="false" defvalue="0" type="int"/>
        <parameter name="executionMode" desc="The parameter to specify the execution mode to run the document. See EnumRWExecutionModes for details." required="false" />
        <parameter name="params" desc="The JSON containing parameters" required="false" />
    </basicInfo>	

	<!-- run rwd event -->
	<eventInfo eventID="2048001" >
    </eventInfo>
	
	<!--
		This information describes how the task is defined in terms of an
		existing Bean.
	-->
	<beanInfo name="rwb" bean-type="RWBean">
		<style name="styleName" source="parameter">
			<actualParameter name="availableWidth" value="availableWidth" source="parameter" />
           	<actualParameter name="availableHeight" value="availableHeight" source="parameter" />
           	<actualParameter name="treesToRender" source="const" value="3" />
            <actualParameter name="resFlags" value="resFlags" source="parameter" />
		</style>
	</beanInfo>
</beanTask>