<!DOCTYPE beanTask SYSTEM "../dtds/beanTask.dtd">
<beanTask>
	<!-- 
		This information is used to provide "metadata" about this task. In general, it includes
		names, descriptions and whether the parameters are required or not. 
	-->
	<basicInfo desc="This Task provides the ability to browse down to an attribute or element in a hierarchy based on browse path. Includes the ability to perform searching and incremental fetch.">
		<!-- parameter for browsing, support incremental fetch and searching -->
		<parameter name="browsePath" desc="Specifies the browse path in the hierarchy. check EnumDataExplorerBeanEvents.DATA_EXPLORER_EVENT_ARGUMENT_BROWSE_PATH for how to construct the browse path." required="true"/>
		<parameter name="searchPattern" desc="Specifies the search pattern." required="false"/>
		<parameter name="matchCase" desc="Specifies whether the search should be performed with case sensitive or not." required="false"/>
		<parameter name="blockBegin" desc="Specifies the blockBegin property for incremental fetch." required="false"/>
		<parameter name="blockCount" desc="Specifies the blockCount property for incremental fetch." required="false"/>
		<parameter name="dataSourcesXML" desc="Specifies the data sources xml to be used by the search" required="false" />
		<parameter name="latlng" desc="Specifies the latitude and longitude for the search" required="false" /> 
		<parameter name="isPathEncoded" desc="Specifies if we have encoded the browsepath at clientside or not" required="false" />
		<parameter name="messageID" desc="Specifies the messageID" required="false" />
	</basicInfo>

	<!--
		This information describes how the task is defined in terms of an existing 
		Event. "4104003" is the EnumDataExplorerBeanEvents.DATA_EXPLORER_EVENT_BROWSE_WITH_PATH Event.
	-->
	<eventInfo eventID="4104003">
		<argument name="dataSources" value="dataSourcesXML" source="parameter"  />
	</eventInfo>
	
	<!--
		This information describes how the task is defined in terms of an existing
		Bean.  The name of the bean is 'deb'. 
	-->
	<beanInfo name="deb" bean-type="DataExplorerBean">	
		<!-- Add a style called 'WidgetDataExplorerStyle' to this bean. -->
		<style name="WidgetDataExplorerStyle" />
	</beanInfo>
</beanTask>
