<!DOCTYPE beanTask SYSTEM "../dtds/beanTask.dtd">
<beanTask class="com.microstrategy.web.app.tasks.RWDataServiceTask">
	<!-- 
		This information is used to provide "metadata" about this task. In general, it includes
		names, descriptions and whether the parameters are required or not. 
	-->
	<basicInfo desc="This Task provides the ability to login, transform a document with the style specified by the caller and logout.">
		<parameter name="styleName" desc="The style to use to transform the RWBean" required="true" type="simplestring"/>
		<parameter name="rwb" desc="The state of the RWBean" required="false" type="simplestring"/>
		<parameter name="objectID" desc="The object ID of the Document to execute." required="false" />
		<parameter name="messageID" desc="The Message ID of a previously executed Report" required="false" />
		<parameter name="gridsResultFlags" desc="The results flags that apply to all grids in the document. See EnumDSSXMLResultFlags for details." required="false" />
		<parameter name="execFlags" desc="The execution flags to use. See EnumDSSXMLDocExecutionFlags for details." required="false" />
	</basicInfo>	

	<!-- run rwd event -->
	<eventInfo eventID="2048001" />
	
	<!--
		This information describes how the task is defined in terms of an existing bean.
	-->
	<beanInfo name="rwb" bean-type="RWBean"/>
</beanTask>
