<!DOCTYPE beanTask SYSTEM "../dtds/beanTask.dtd">
<beanTask class="com.microstrategy.web.app.tasks.RWManipulationTask">
	<!-- 
		This information is used to provide "metadata" about this task. In general, it includes
		names, descriptions and whether the parameters are required or not. 
	-->
	<basicInfo desc="This task sets current elements for control on graph.">
		<parameter name="messageID" desc="The Message ID of a previously executed Report Writer Document." required="false" type="guid"/>
		<parameter name="selectorKeyContext" desc="The key context of the Selector Control. It may be a simple key for the control or a key with tree type and node type (all separated by ITEM_SEPARATOR)." required="true" />
		<parameter name="targetList" desc="A list of target keys separated by the ITEM_SEPARATOR (see EnumRWBeanEvents for details)." required="false"/>
        <parameter name="sliceID" desc="Graph slice ID" required="true"/>
        <parameter name="x" desc="Cursor X coordinate." required="true"/>
        <parameter name="y" desc="Cursor Y coordinate" required="true"/>
        <parameter name="ctrlKeys" desc="A list of control keys separated by the ITEM_SEPARATOR (see EnumRWBeanEvents for details)." required="false"/>
		
	</basicInfo>	

	<!-- REPORT_WRITER_EVENT_APPLY_GRAPH_CONTROL_ACTION -->
	<eventInfo eventID="2048082">
		<!-- argument name="usePartDisplay" source="const" value="1" /-->
		<argument name="unitKeyContext" source="parameter" value="selectorKeyContext" />
		<argument name="ctlTargetStr" source="parameter" value="targetList" />
	</eventInfo>
	
	<!--
		This information describes how the task is defined in terms of an existing
		Bean.
	-->
	<beanInfo name="rwb" bean-type="RWBean">
		<style name="RWDocumentMojoStyle">
			<actualParameter name="treesToRender" source="const" value="2" />
            <actualParameter name="zoomFactor" value="zoomFactor" source="parameter"/>
		</style>
	</beanInfo>
</beanTask>
